{
  "schema_version": "0.1",
  "map_vision_id": "MV-EXAMPLE-VILLAGE-001",
  "version": "0.1",
  "status": "pending_human_approval",
  "atlas_screen_id": "SCR-EXAMPLE-VILLAGE-001",
  "map_intent_ref": "MI-EXAMPLE-VILLAGE-001@0.1",
  "title": "Example temperate village visual brief",
  "emotional_read": [{"statement_id":"ST-EMOTION-001","text":"Safe and welcoming at first glance, with older infrastructure creating quiet mystery.","authority":"approved_visual_direction","confidence":"provisional","source_refs":["HUMAN-DIRECTION-001"]}],
  "memorable_identity": {"statement_id":"ST-IDENTITY-001","text":"A working farm village gathered around a roofed stone well and reused remnants of an older facility.","authority":"required_canon","confidence":"verified","source_refs":["SCR-EXAMPLE-VILLAGE-001"]},
  "geography": [{"statement_id":"ST-GEOGRAPHY-001","text":"A shallow valley remains open at every required route.","authority":"required_canon","confidence":"verified","source_refs":["SCR-EXAMPLE-VILLAGE-001"]}],
  "first_view": [{"statement_id":"ST-FIRSTVIEW-001","text":"The arrival view reads the road, well, inn silhouette, and northern tree line in that order.","authority":"approved_visual_direction","confidence":"provisional","source_refs":["HUMAN-DIRECTION-001"]}],
  "landmarks": [{"landmark_id":"LM-CENTRAL-WELL","role":"dominant","description":"Roofed stone well at the civic road junction.","authority":"required_canon","confidence":"verified","source_refs":["SCR-EXAMPLE-VILLAGE-001"]}],
  "building_silhouettes": [{"building_role":"village_cottage","scale":"small","height_profile":"Low two-storey-read silhouette; roof does not dominate the camera view.","shape_language":"Compact timber cottage with a shallow irregular footprint.","variation_rules":["Vary width, roof offset, and attached utility volume without changing the material family."],"authority":"approved_visual_direction","confidence":"provisional","source_refs":["HUMAN-DIRECTION-001","PAT-REFERENCE-VILLAGE"]}],
  "materials": [{"statement_id":"ST-MATERIAL-001","text":"Timber, local stone, restrained plaster, dark slate, and visibly reused metal.","authority":"required_canon","confidence":"verified","source_refs":["SCR-EXAMPLE-VILLAGE-001"]}],
  "color_language": [{"statement_id":"ST-COLOR-001","text":"Warm earth and timber against green vegetation; cool old metal is a subordinate accent.","authority":"approved_visual_direction","confidence":"provisional","source_refs":["HUMAN-DIRECTION-001"]}],
  "roads_and_circulation": [{"statement_id":"ST-ROAD-001","text":"A curved civic spine joins every canonical exit and visibly reaches every public door.","authority":"required_canon","confidence":"verified","source_refs":["SCR-EXAMPLE-VILLAGE-001"]}],
  "density": {"overall":"moderate","negative_space":"Keep the well square legible and use looser cultivated edges as breathing room.","zones":[{"zone_role":"civic_core","density":"moderate","purpose":"Readable gathering space."},{"zone_role":"forest_edge","density":"dense","purpose":"Natural boundary outside required routes."}],"authority":"approved_visual_direction","confidence":"provisional","source_refs":["HUMAN-DIRECTION-001"]},
  "environmental_storytelling": [{"story_signal":"Residents live alongside misunderstood old infrastructure.","visual_expression":"Patched metal fencing and a warm vent are integrated into ordinary village use.","authority":"required_canon","confidence":"verified","source_refs":["SCR-EXAMPLE-VILLAGE-001"]}],
  "story_state_variants": [],
  "canon_anchors": [{"anchor_id":"CA-REQUIRED-ROUTES","requirement":"Preserve every route and transfer named by the canonical screen.","source_refs":["SCR-EXAMPLE-VILLAGE-001"]}],
  "exclusions": [{"exclusion_id":"EX-NO-NEW-ROLE","description":"Do not invent a blacksmith, guild, or other settlement service.","reason":"A visual brief cannot silently add story canon.","source_refs":["SCR-EXAMPLE-VILLAGE-001","HUMAN-DIRECTION-001"]}],
  "concept_direction": {"status":"not_created","artifact_refs":[],"use_policy":"visual_direction_only_not_structural_evidence"},
  "source_provenance": [{"source_ref":"SCR-EXAMPLE-VILLAGE-001","source_type":"atlas_canon","authority":"required_canon","revision":"0.2"},{"source_ref":"HUMAN-DIRECTION-001","source_type":"human_direction","authority":"approved_visual_direction","revision":"2026-07-15"},{"source_ref":"PAT-REFERENCE-VILLAGE","source_type":"academy_reference","authority":"optional_inspiration","revision":"0.1"}],
  "approval": {"canon_reconciled":true,"unresolved_conflicts":[],"approved_by":null,"approved_at":null}
}
